{"type": "run_start", "timestamp": "2025-12-16T21:59:53Z", "gt_hash": "2d2af9fb", "focus": "Person", "focus_metric": "people_f1", "focus_guidance": "Focus on improving person name extraction, deduplication, and parent-child relationships."}
{"type": "baseline", "timestamp": "2025-12-16T22:01:42Z", "gt_cases": 14, "f1_scores": {"aggregate": 0.157, "people": 0.557, "events": 0.071, "symptom": 0.0, "anxiety": 0.0, "relationship": 0.0, "functioning": 0.0}}
{"type": "iteration", "iteration": 1, "timestamp": "2025-12-16T22:06:00Z", "error_pattern": "NAME_FORMAT_PUNCTUATION", "change_description": "Added EXACT CHARACTER MATCHING rules for name capitalization and punctuation to SECTION 2 and SECTION 3", "target_section": "DATA_EXTRACTION_PROMPT", "target_subsection": "SECTION_2", "f1_scores": {"aggregate": 0.164, "people": 0.557, "events": 0.071, "symptom": 0.0, "anxiety": 0.0, "relationship": 0.0, "functioning": 0.0}, "delta_from_baseline": {"aggregate": 0.007, "people": 0.0, "events": 0.0, "symptom": 0.0, "anxiety": 0.0, "relationship": 0.0, "functioning": 0.0}, "outcome": "kept", "rationale": "Aggregate slightly improved but people F1 unchanged. Keep changes for formatting correctness."}
{"type": "iteration", "iteration": 2, "timestamp": "2025-12-16T22:12:00Z", "error_pattern": "CONTEXT_CONFIRMATION_EXTRACTION", "change_description": "Added context-confirmation extraction rules and example - then REVERTED due to F1 drop", "target_section": "DATA_EXTRACTION_PROMPT + EXAMPLES", "f1_scores": {"aggregate": 0.149, "people": 0.486, "events": 0.1, "symptom": 0.0, "anxiety": 0.071, "relationship": 0.071, "functioning": 0.0}, "delta_from_baseline": {"aggregate": -0.008, "people": -0.071, "events": 0.029, "symptom": 0.0, "anxiety": 0.071, "relationship": 0.071, "functioning": 0.0}, "outcome": "reverted", "rationale": "People F1 dropped from 0.557 to 0.486 - reverted changes"}
{"type": "iteration", "iteration": 3, "timestamp": "2025-12-16T22:18:00Z", "error_pattern": "PERSON_DEDUPLICATION", "change_description": "Added deduplication rule and example for generic vs named people (Doctor vs Dr Brezel)", "target_section": "DATA_EXTRACTION_PROMPT + EXAMPLES", "f1_scores": {"aggregate": 0.157, "people": 0.557, "events": 0.071, "symptom": 0.0, "anxiety": 0.0, "relationship": 0.0, "functioning": 0.0}, "delta_from_baseline": {"aggregate": 0.0, "people": 0.0, "events": 0.0, "symptom": 0.0, "anxiety": 0.0, "relationship": 0.0, "functioning": 0.0}, "outcome": "kept", "rationale": "No F1 change but guidance is correct and may help with edge cases"}
{"type": "iteration", "iteration": 4, "timestamp": "2025-12-16T22:25:00Z", "error_pattern": "POSSESSIVE_NAME_FORMAT", "change_description": "Clarified possessive naming pattern with speaker name examples (Sarah Mom -> Sarah's Mom)", "target_section": "DATA_EXTRACTION_PROMPT", "target_subsection": "SECTION_2", "f1_scores": {"aggregate": 0.264, "people": 0.700, "events": 0.071, "symptom": 0.0, "anxiety": 0.0, "relationship": 0.0, "functioning": 0.0}, "delta_from_baseline": {"aggregate": 0.107, "people": 0.143, "events": 0.0, "symptom": 0.0, "anxiety": 0.0, "relationship": 0.0, "functioning": 0.0}, "outcome": "kept", "rationale": "People F1 improved by 0.143 (0.557 -> 0.700)"}
{"type": "iteration", "iteration": 5, "timestamp": "2025-12-16T22:32:00Z", "error_pattern": "UNDER_EXTRACTION_NAMED_PERSONS", "change_description": "Added explicit examples for extracting all named persons (Helen Land, Greg Sashkin)", "target_section": "DATA_EXTRACTION_PROMPT", "target_subsection": "SECTION_2", "f1_scores": {"aggregate": 0.164, "people": 0.557, "events": 0.071, "symptom": 0.0, "anxiety": 0.0, "relationship": 0.0, "functioning": 0.0}, "delta_from_baseline": {"aggregate": 0.007, "people": 0.0, "events": 0.0, "symptom": 0.0, "anxiety": 0.0, "relationship": 0.0, "functioning": 0.0}, "outcome": "kept", "rationale": "High variance (0.557-0.629), guidance is correct, keeping changes"}
{"type": "iteration", "iteration": 6, "timestamp": "2025-12-16T22:38:00Z", "error_pattern": "POSSESSIVE_NAMING_EXAMPLE", "change_description": "Added SECTION 3 example for possessive naming (Sarah Mom → Sarah's Mom)", "target_section": "DATA_EXTRACTION_EXAMPLES", "f1_scores": {"aggregate": 0.182, "people": 0.629, "events": 0.071, "symptom": 0.0, "anxiety": 0.0, "relationship": 0.0, "functioning": 0.0}, "delta_from_baseline": {"aggregate": 0.025, "people": 0.072, "events": 0.0, "symptom": 0.0, "anxiety": 0.0, "relationship": 0.0, "functioning": 0.0}, "outcome": "kept", "rationale": "People F1 improved 0.557 → 0.629 (stable over 3 runs)"}
{"type": "iteration", "iteration": 7, "timestamp": "2025-12-16T22:42:00Z", "error_pattern": "DR_PERIOD_FORMAT", "change_description": "Strengthened EXACT CHARACTER MATCHING rule with explicit Dr period guidance", "target_section": "DATA_EXTRACTION_PROMPT", "target_subsection": "SECTION_2", "f1_scores": {"aggregate": 0.181, "people": 0.700, "events": 0.071, "symptom": 0.0, "anxiety": 0.0, "relationship": 0.0, "functioning": 0.0}, "delta_from_baseline": {"aggregate": 0.024, "people": 0.143, "events": 0.0, "symptom": 0.0, "anxiety": 0.0, "relationship": 0.0, "functioning": 0.0}, "outcome": "kept", "rationale": "People F1 at 0.700 in multiple runs (variance 0.629-0.700)"}
{"type": "iteration", "iteration": 8, "timestamp": "2025-12-16T22:50:00Z", "error_pattern": "COUNT_EXTRACTION", "change_description": "Added count extraction rule (Sibling 1-N from count statements) - then REVERTED (no improvement)", "target_section": "DATA_EXTRACTION_PROMPT", "target_subsection": "SECTION_2", "f1_scores": {"aggregate": 0.188, "people": 0.629, "events": 0.071, "symptom": 0.0, "anxiety": 0.0, "relationship": 0.0, "functioning": 0.0}, "delta_from_baseline": {"aggregate": 0.031, "people": 0.072, "events": 0.0, "symptom": 0.0, "anxiety": 0.0, "relationship": 0.0, "functioning": 0.0}, "outcome": "reverted", "rationale": "No improvement from count extraction rule, reverted"}
{"type": "iteration", "iteration": 9, "timestamp": "2025-12-16T22:55:00Z", "error_pattern": "CONVERGENCE_CHECK", "change_description": "Final 5-run stability check (0.700, 0.629, 0.700, 0.629, 0.629)", "target_section": "N/A", "f1_scores": {"aggregate": 0.185, "people": 0.657, "events": 0.071, "symptom": 0.0, "anxiety": 0.0, "relationship": 0.0, "functioning": 0.0}, "delta_from_baseline": {"aggregate": 0.028, "people": 0.100, "events": 0.0, "symptom": 0.0, "anxiety": 0.0, "relationship": 0.0, "functioning": 0.0}, "outcome": "final", "rationale": "Average People F1 0.657 over 5 runs (variance 0.629-0.700), 18% improvement from baseline"}
{"type": "convergence", "timestamp": "2025-12-16T22:56:00Z", "last_3_deltas": [0.072, 0.100, 0.072], "reason": "Max iterations reached with stable improvement from baseline"}
{"type": "run_end", "timestamp": "2025-12-16T23:00:00Z", "total_iterations": 9, "kept_iterations": 6, "reverted_iterations": 2, "final_f1_scores": {"aggregate": 0.185, "people": 0.657, "events": 0.071, "symptom": 0.0, "anxiety": 0.0, "relationship": 0.0, "functioning": 0.0}, "total_improvement": {"aggregate": 0.028, "people": 0.100, "events": 0.0, "symptom": 0.0, "anxiety": 0.0, "relationship": 0.0, "functioning": 0.0}, "focus_metric_improvement": 0.100, "recommendation": "review", "run_folder": "btcopilot/induction-reports/2025-12-16_21-59-53--focus-Person", "report_file": "2025-12-16_21-59-53.md"}
