{"type": "run_start", "timestamp": "2025-12-16T16:59:29Z", "gt_cases": null, "gt_hash": "64d635ea", "focus": "Person", "focus_metric": "people_f1", "focus_guidance": "Focus on improving person name extraction, deduplication, and parent-child relationships."}
{"type": "baseline", "timestamp": "2025-12-16T17:00:30Z", "f1_scores": {"aggregate": 0.056, "people": 0.443, "events": 0.143, "symptom": 0.0, "anxiety": 0.0, "relationship": 0.0, "functioning": 0.0}}
{"type": "iteration", "iteration": 1, "timestamp": "2025-12-16T17:04:00Z", "error_pattern": "PERSON_TITLE_STRIPPING", "error_count": 6, "change_description": "Strengthened MANDATORY TITLE PRESERVATION rules in SECTION 2, added explicit examples and non-negotiable language", "target_section": "DATA_EXTRACTION_PROMPT", "target_subsection": "SECTION_2", "old_text_snippet": "Preserve honorifics and titles EXACTLY...", "new_text_snippet": "MANDATORY TITLE PRESERVATION: When a person is mentioned with a title...", "f1_scores": {"aggregate": 0.129, "people": 0.557, "events": 0.143, "symptom": 0.0, "anxiety": 0.0, "relationship": 0.0, "functioning": 0.0}, "delta_from_baseline": {"aggregate": 0.073, "people": 0.114, "events": 0.0, "symptom": 0.0, "anxiety": 0.0, "relationship": 0.0, "functioning": 0.0}, "outcome": "kept", "rationale": "People F1 improved significantly from 0.443 to 0.557"}
{"type": "iteration", "iteration": 2, "timestamp": "2025-12-16T17:08:00Z", "error_pattern": "UNDER_EXTRACTION_NON_FAMILY_PERSONS", "error_count": 4, "change_description": "Added examples for non-family person extraction and role-based descriptors", "target_section": "DATA_EXTRACTION_EXAMPLES", "target_subsection": "SECTION_3", "old_text_snippet": "RULE: Use the EXACT name format...", "new_text_snippet": "Added UNDER_EXTRACTION_NON_FAMILY_PERSONS and UNDER_EXTRACTION_ROLE_DESCRIPTORS examples", "f1_scores": {"aggregate": 0.061, "people": 0.429, "events": 0.143, "symptom": 0.0, "anxiety": 0.0, "relationship": 0.0, "functioning": 0.0}, "delta_from_baseline": {"aggregate": 0.005, "people": -0.014, "events": 0.0, "symptom": 0.0, "anxiety": 0.0, "relationship": 0.0, "functioning": 0.0}, "outcome": "reverted", "rationale": "People F1 dropped from 0.557 to 0.429, reverting"}
{"type": "iteration", "iteration": 3, "timestamp": "2025-12-16T17:12:00Z", "error_pattern": "UNDER_EXTRACTION_NON_FAMILY_PERSONS", "error_count": 2, "change_description": "Refined wording for extracting people with full names", "target_section": "DATA_EXTRACTION_PROMPT", "target_subsection": "SECTION_2", "old_text_snippet": "Extract ALL people mentioned, even in passing...", "new_text_snippet": "Extract ALL people mentioned by full name...", "f1_scores": {"aggregate": 0.093, "people": 0.486, "events": 0.143, "symptom": 0.0, "anxiety": 0.0, "relationship": 0.0, "functioning": 0.0}, "delta_from_baseline": {"aggregate": 0.037, "people": 0.043, "events": 0.0, "symptom": 0.0, "anxiety": 0.0, "relationship": 0.0, "functioning": 0.0}, "outcome": "reverted", "rationale": "People F1 dropped from 0.557 to 0.486, reverting"}
{"type": "iteration", "iteration": 4, "timestamp": "2025-12-16T17:16:00Z", "error_pattern": "PERSON_POSSESSIVE_PATTERNS", "error_count": 10, "change_description": "Added example for possessive patterns like Marcus Mother", "target_section": "DATA_EXTRACTION_EXAMPLES", "target_subsection": "SECTION_3", "old_text_snippet": "RULE: When you see Name born...", "new_text_snippet": "Added PERSON_POSSESSIVE_PATTERNS example with Marcus Mother", "f1_scores": {"aggregate": 0.032, "people": 0.414, "events": 0.143, "symptom": 0.0, "anxiety": 0.0, "relationship": 0.0, "functioning": 0.0}, "delta_from_baseline": {"aggregate": -0.024, "people": -0.029, "events": 0.0, "symptom": 0.0, "anxiety": 0.0, "relationship": 0.0, "functioning": 0.0}, "outcome": "reverted", "rationale": "People F1 dropped from 0.557 to 0.414, reverting"}
{"type": "iteration", "iteration": 5, "timestamp": "2025-12-16T17:20:00Z", "error_pattern": "PERSON_DEFINITION_BROADENING", "error_count": 0, "change_description": "Expanded Person definition in SECTION 1 to include non-family individuals", "target_section": "DATA_EXTRACTION_PROMPT", "target_subsection": "SECTION_1", "old_text_snippet": "Any individuals involved in the story of shifts...", "new_text_snippet": "Any individual mentioned in the users statement...", "f1_scores": {"aggregate": 0.093, "people": 0.486, "events": 0.143, "symptom": 0.0, "anxiety": 0.0, "relationship": 0.0, "functioning": 0.0}, "delta_from_baseline": {"aggregate": 0.037, "people": 0.043, "events": 0.0, "symptom": 0.0, "anxiety": 0.0, "relationship": 0.0, "functioning": 0.0}, "outcome": "reverted", "rationale": "People F1 dropped from 0.557 to 0.486, reverting"}
{"type": "iteration", "iteration": 6, "timestamp": "2025-12-16T17:24:00Z", "error_pattern": "PERSON_TITLE_STRIPPING", "error_count": 6, "change_description": "Refined title preservation rule in SECTION 3 example - made bullet points more explicit and added penalty warning", "target_section": "DATA_EXTRACTION_EXAMPLES", "target_subsection": "SECTION_3", "old_text_snippet": "RULE: Use the EXACT name format the user provides, including:", "new_text_snippet": "RULE: Use the EXACT name format the user provides, including ALL titles/honorifics:", "f1_scores": {"aggregate": 0.200, "people": 0.633, "events": 0.143, "symptom": 0.0, "anxiety": 0.0, "relationship": 0.0, "functioning": 0.0}, "delta_from_baseline": {"aggregate": 0.144, "people": 0.190, "events": 0.0, "symptom": 0.0, "anxiety": 0.0, "relationship": 0.0, "functioning": 0.0}, "outcome": "kept", "rationale": "People F1 improved from 0.557 to 0.633 (+0.076)"}
{"type": "iteration", "iteration": 7, "timestamp": "2025-12-16T17:28:00Z", "error_pattern": "PERSON_EXTRACTION_THOROUGHNESS", "error_count": 0, "change_description": "Changed SPARSE EVENTS rule wording to emphasize THOROUGH PEOPLE", "target_section": "DATA_EXTRACTION_PROMPT", "target_subsection": "SECTION_2", "old_text_snippet": "SPARSE EVENTS, NOT PEOPLE...", "new_text_snippet": "SPARSE EVENTS, THOROUGH PEOPLE...", "f1_scores": {"aggregate": 0.141, "people": 0.557, "events": 0.143, "symptom": 0.0, "anxiety": 0.0, "relationship": 0.0, "functioning": 0.0}, "delta_from_baseline": {"aggregate": 0.085, "people": 0.114, "events": 0.0, "symptom": 0.0, "anxiety": 0.0, "relationship": 0.0, "functioning": 0.0}, "outcome": "reverted", "rationale": "People F1 dropped from 0.633 to 0.557, reverting"}
{"type": "iteration", "iteration": 8, "timestamp": "2025-12-16T17:34:00Z", "error_pattern": "PERSON_NAMED_INDIVIDUALS", "error_count": 0, "change_description": "Clarified Extract ALL named individuals rule with explicit examples", "target_section": "DATA_EXTRACTION_PROMPT", "target_subsection": "SECTION_2", "old_text_snippet": "Any person mentioned by name...", "new_text_snippet": "Every person mentioned by name must be extracted...", "f1_scores": {"aggregate": 0.061, "people": 0.429, "events": 0.143, "symptom": 0.0, "anxiety": 0.0, "relationship": 0.0, "functioning": 0.0}, "delta_from_baseline": {"aggregate": 0.005, "people": -0.014, "events": 0.0, "symptom": 0.0, "anxiety": 0.0, "relationship": 0.0, "functioning": 0.0}, "outcome": "reverted", "rationale": "People F1 dropped from ~0.6 to 0.429, reverting"}
{"type": "iteration", "iteration": 9, "timestamp": "2025-12-16T17:40:00Z", "error_pattern": "PERSON_TITLE_STRIPPING", "error_count": 0, "change_description": "Strengthened WHY WRONG explanation in PERSON_NAME_PRESERVE_TITLES example", "target_section": "DATA_EXTRACTION_EXAMPLES", "target_subsection": "SECTION_3", "old_text_snippet": "these titles are part of the name as spoken", "new_text_snippet": "these titles are PART OF THE NAME. Stripping them is ALWAYS wrong", "f1_scores": {"aggregate": 0.093, "people": 0.486, "events": 0.143, "symptom": 0.0, "anxiety": 0.0, "relationship": 0.0, "functioning": 0.0}, "delta_from_baseline": {"aggregate": 0.037, "people": 0.043, "events": 0.0, "symptom": 0.0, "anxiety": 0.0, "relationship": 0.0, "functioning": 0.0}, "outcome": "reverted", "rationale": "People F1 dropped from 0.586 to 0.486, reverting"}
{"type": "convergence", "timestamp": "2025-12-16T17:42:00Z", "last_3_deltas": [-0.029, -0.157, -0.100], "reason": "3 consecutive iterations required reverting - no further improvements possible without structural changes"}
{"type": "run_end", "timestamp": "2025-12-16T17:45:00Z", "total_iterations": 9, "kept_iterations": 2, "reverted_iterations": 7, "final_f1_scores": {"aggregate": 0.224, "people": 0.657, "events": 0.143, "symptom": 0.0, "anxiety": 0.0, "relationship": 0.0, "functioning": 0.0}, "total_improvement": {"aggregate": 0.168, "people": 0.214, "events": 0.0, "symptom": 0.0, "anxiety": 0.0, "relationship": 0.0, "functioning": 0.0}, "focus_metric_improvement": 0.214, "recommendation": "commit", "run_folder": "btcopilot/induction-reports/2025-12-16_16-59-29--focus-Person", "report_file": "2025-12-16_16-59-29.md"}
