{"type": "run_start", "timestamp": "2025-12-16T15:42:55Z", "gt_cases": 74, "gt_hash": "64d635ea", "focus": "Person", "focus_metric": "people_f1", "focus_guidance": "Focus on improving person name extraction, deduplication, and parent-child relationships."}
{"type": "baseline", "timestamp": "2025-12-16T15:45:00Z", "f1_scores": {"aggregate": 0.075, "people": 0.550, "events": 0.162, "symptom": 0.000, "anxiety": 0.000, "relationship": 0.000, "functioning": 0.000}}
{"type": "iteration", "iteration": 1, "timestamp": "2025-12-16T15:52:00Z", "error_pattern": "UNDER_EXTRACTION_PEOPLE", "error_count": 23, "change_description": "Added PERSON EXTRACTION RULES section emphasizing extract ALL named individuals, preserve titles/honorifics, extract role-based references", "target_section": "DATA_EXTRACTION_PROMPT", "target_subsection": "SECTION_2", "old_text_snippet": "SPARSE OUTPUT: Most of the time you will likely return very few items...", "new_text_snippet": "PERSON EXTRACTION RULES (CRITICAL FOR people_f1): Extract ALL named individuals...", "f1_scores": {"aggregate": 0.118, "people": 0.608, "events": 0.162, "symptom": 0.000, "anxiety": 0.000, "relationship": 0.000, "functioning": 0.000}, "delta_from_baseline": {"aggregate": 0.043, "people": 0.058, "events": 0.000, "symptom": 0.000, "anxiety": 0.000, "relationship": 0.000, "functioning": 0.000}, "outcome": "kept", "rationale": "People F1 improved from 0.550 to 0.608 (+0.058)"}
{"type": "iteration", "iteration": 2, "timestamp": "2025-12-16T15:58:00Z", "error_pattern": "PERSON_NAME_STRIP_TITLES", "error_count": 8, "change_description": "Added PERSON_NAME_PRESERVE_TITLES example showing Aunt Linda not Linda, Uncle Tom not Tom", "target_section": "DATA_EXTRACTION_EXAMPLES", "target_subsection": "SECTION_3", "old_text_snippet": "N/A - new example added", "new_text_snippet": "PERSON_NAME_PRESERVE_TITLES example: Aunt Linda not Linda...", "f1_scores": {"aggregate": 0.127, "people": 0.615, "events": 0.189, "symptom": 0.000, "anxiety": 0.000, "relationship": 0.000, "functioning": 0.000}, "delta_from_baseline": {"aggregate": 0.052, "people": 0.065, "events": 0.027, "symptom": 0.000, "anxiety": 0.000, "relationship": 0.000, "functioning": 0.000}, "delta_from_previous": {"aggregate": 0.009, "people": 0.007, "events": 0.027, "symptom": 0.000, "anxiety": 0.000, "relationship": 0.000, "functioning": 0.000}, "outcome": "kept", "rationale": "People F1 improved from 0.608 to 0.615 (+0.007)"}
{"type": "iteration", "iteration": 3, "timestamp": "2025-12-16T16:05:00Z", "error_pattern": "UNDER_EXTRACTION_PERIPHERAL_PEOPLE", "error_count": 23, "change_description": "Added UNDER_EXTRACTION_PERIPHERAL_PEOPLE example showing Woman on bus and Helen Land extraction", "target_section": "DATA_EXTRACTION_EXAMPLES", "target_subsection": "SECTION_3", "old_text_snippet": "N/A - new example added", "new_text_snippet": "UNDER_EXTRACTION_PERIPHERAL_PEOPLE example...", "f1_scores": {"aggregate": 0.111, "people": 0.598, "events": 0.176, "symptom": 0.000, "anxiety": 0.000, "relationship": 0.000, "functioning": 0.000}, "delta_from_baseline": {"aggregate": 0.036, "people": 0.048, "events": 0.014, "symptom": 0.000, "anxiety": 0.000, "relationship": 0.000, "functioning": 0.000}, "delta_from_previous": {"aggregate": -0.016, "people": -0.017, "events": -0.013, "symptom": 0.000, "anxiety": 0.000, "relationship": 0.000, "functioning": 0.000}, "outcome": "reverted", "rationale": "People F1 dropped from 0.615 to 0.598"}
{"type": "iteration", "iteration": 4, "timestamp": "2025-12-16T16:15:00Z", "error_pattern": "PERSON_NAME_FORMAT", "error_count": 9, "change_description": "Refined PERSON EXTRACTION RULES: added possessive pattern guidance for unnamed relations", "target_section": "DATA_EXTRACTION_PROMPT", "target_subsection": "SECTION_2", "old_text_snippet": "Extract people even from short statements...", "new_text_snippet": "Use possessive patterns for unnamed relations: Users Mother, Marcus Girlfriend...", "f1_scores": {"aggregate": 0.138, "people": 0.622, "events": 0.169, "symptom": 0.014, "anxiety": 0.014, "relationship": 0.014, "functioning": 0.000}, "delta_from_baseline": {"aggregate": 0.063, "people": 0.072, "events": 0.007, "symptom": 0.014, "anxiety": 0.014, "relationship": 0.014, "functioning": 0.000}, "delta_from_previous": {"aggregate": 0.011, "people": 0.007, "events": -0.007, "symptom": 0.014, "anxiety": 0.014, "relationship": 0.014, "functioning": 0.000}, "outcome": "kept", "rationale": "People F1 stable with slight improvements in SARF metrics"}
{"type": "iteration", "iteration": 5, "timestamp": "2025-12-16T16:22:00Z", "error_pattern": "OUTPUT_INSTRUCTIONS", "error_count": 0, "change_description": "Modified Output Instructions to encourage people extraction", "target_section": "DATA_EXTRACTION_PROMPT", "target_subsection": "SECTION_2", "old_text_snippet": "Return SPARSE deltas - often empty arrays if nothing new...", "new_text_snippet": "For people: Extract EVERY named/role-referenced person...", "f1_scores": {"aggregate": 0.120, "people": 0.601, "events": 0.185, "symptom": 0.014, "anxiety": 0.014, "relationship": 0.014, "functioning": 0.014}, "delta_from_baseline": {"aggregate": 0.045, "people": 0.051, "events": 0.023, "symptom": 0.014, "anxiety": 0.014, "relationship": 0.014, "functioning": 0.014}, "delta_from_previous": {"aggregate": -0.018, "people": -0.021, "events": 0.016, "symptom": 0.000, "anxiety": 0.000, "relationship": 0.000, "functioning": 0.014}, "outcome": "reverted", "rationale": "People F1 dropped from 0.622 to 0.601"}
{"type": "convergence", "timestamp": "2025-12-16T16:28:00Z", "last_3_deltas": [0.007, -0.017, -0.021], "reason": "Alternating improvements and regressions with high variance - approaching prompt optimization limit"}
{"type": "run_end", "timestamp": "2025-12-16T16:32:00Z", "total_iterations": 5, "kept_iterations": 3, "reverted_iterations": 2, "final_f1_scores": {"aggregate": 0.116, "people": 0.606, "events": 0.176, "symptom": 0.014, "anxiety": 0.014, "relationship": 0.014, "functioning": 0.014}, "total_improvement": {"aggregate": 0.041, "people": 0.056, "events": 0.014, "symptom": 0.014, "anxiety": 0.014, "relationship": 0.014, "functioning": 0.014}, "focus_metric_improvement": 0.056, "recommendation": "review", "run_folder": "btcopilot/induction-reports/2025-12-16_15-42-55--focus-Person", "report_file": "2025-12-16_15-42-55.md"}
